"DESCRIPTION","DURATION IN MS","NAME","PARENT SUITE","START TIME","STATUS","STOP TIME","SUB SUITE","SUITE","TEST CLASS","TEST METHOD"
"","1488","Should block SQL Injection Attempt before password step","","2026-02-21","passed","2026-02-21","","Rydoo Login - Security Boundary Tests","",""
"","2683","Should display correct error for: HTML Injection","","2026-02-21","passed","2026-02-21","","Rydoo Login - Negative Test Suite","",""
"","2619","Should display correct error for: Special Characters","","2026-02-21","passed","2026-02-21","","Rydoo Login - Negative Test Suite","",""
"","3219","Should display correct error for: Unregistered User","","2026-02-21","passed","2026-02-21","","Rydoo Login - Negative Test Suite","",""
"","2921","Should display correct error for: SQL Bypass Attempt","","2026-02-21","passed","2026-02-21","","Rydoo Login - Negative Test Suite","",""
"","2812","should login successfully on QA envirenment","","2026-02-21","passed","2026-02-21","","Happy Path Login Execution","",""
"","6240","Should display correct error for: Wrong Password","","2026-02-21","passed","2026-02-21","","Rydoo Login - Negative Test Suite","",""
"","1554","Should block XSS Injection Attempt before password step","","2026-02-21","passed","2026-02-21","","Rydoo Login - Security Boundary Tests","",""
